[
  {
    "source": "discipline_hri",
    "target": "discipline_hci",
    "relation_type": "related_to",
    "description": "HRI shares methods and theories with HCI.",
    "evidence": [
      "S01",
      "S24"
    ],
    "directionality": "directed",
    "confidence_level": "high",
    "design_implication": "HCI 方法可迁移到机器人交互。"
  },
  {
    "source": "discipline_hri",
    "target": "discipline_robotics",
    "relation_type": "related_to",
    "description": "HRI connects interaction research with robotics systems.",
    "evidence": [
      "S01",
      "S23"
    ],
    "directionality": "directed",
    "confidence_level": "high",
    "design_implication": "设计需要理解机器人能力边界。"
  },
  {
    "source": "discipline_hri",
    "target": "discipline_human_factors",
    "relation_type": "related_to",
    "description": "HRI uses human factors metrics and safety thinking.",
    "evidence": [
      "S05",
      "S33"
    ],
    "directionality": "directed",
    "confidence_level": "high",
    "design_implication": "信任、负荷、安全需要量化。"
  },
  {
    "source": "concept_intelligent_interaction_design",
    "target": "discipline_hci",
    "relation_type": "extends",
    "description": "Intelligent interaction design extends HCI toward AI-enabled systems.",
    "evidence": [],
    "directionality": "directed",
    "confidence_level": "medium",
    "design_implication": "设计对象从界面扩展到智能行为。"
  },
  {
    "source": "concept_intelligent_interaction_design",
    "target": "discipline_hri",
    "relation_type": "applied_to",
    "description": "The design lens is applied to HRI problems.",
    "evidence": [],
    "directionality": "directed",
    "confidence_level": "medium",
    "design_implication": "将 HRI 技术模块转译成体验问题。"
  },
  {
    "source": "concept_embodied_interaction",
    "target": "theory_situated_action",
    "relation_type": "derived_from",
    "description": "Embodied interaction is aligned with situated action.",
    "evidence": [
      "S16",
      "S17"
    ],
    "directionality": "directed",
    "confidence_level": "high",
    "design_implication": "交互分析应包含现场行为。"
  },
  {
    "source": "concept_affordance",
    "target": "concept_embodied_interaction",
    "relation_type": "related_to",
    "description": "Affordance explains action possibilities in embodied contexts.",
    "evidence": [
      "S16"
    ],
    "directionality": "directed",
    "confidence_level": "medium",
    "design_implication": "设计机器人任务可供性。"
  },
  {
    "source": "concept_robot_autonomy",
    "target": "theory_levels_automation",
    "relation_type": "derived_from",
    "description": "Robot autonomy can be analyzed through levels of automation.",
    "evidence": [
      "S07",
      "S09"
    ],
    "directionality": "directed",
    "confidence_level": "high",
    "design_implication": "不要把自主性当成单一开关。"
  },
  {
    "source": "concept_shared_autonomy",
    "target": "concept_robot_autonomy",
    "relation_type": "is_part_of",
    "description": "Shared autonomy is a mode within autonomy design.",
    "evidence": [
      "S09"
    ],
    "directionality": "directed",
    "confidence_level": "high",
    "design_implication": "适合可调控制权。"
  },
  {
    "source": "concept_shared_autonomy",
    "target": "tech_intention_recognition",
    "relation_type": "depends_on",
    "description": "Shared autonomy often needs inference of human goals.",
    "evidence": [],
    "directionality": "directed",
    "confidence_level": "medium",
    "design_implication": "意图识别错误需要可恢复机制。"
  },
  {
    "source": "concept_shared_autonomy",
    "target": "concept_human_agency",
    "relation_type": "improves",
    "description": "When designed well, shared autonomy can preserve human agency.",
    "evidence": [],
    "directionality": "directed",
    "confidence_level": "medium",
    "design_implication": "辅助强度需可调。"
  },
  {
    "source": "concept_robot_autonomy",
    "target": "metric_trust",
    "relation_type": "influences",
    "description": "Autonomy influences how users trust and rely on robots.",
    "evidence": [
      "S05",
      "S09"
    ],
    "directionality": "directed",
    "confidence_level": "high",
    "design_implication": "需要信任校准而不是盲目信任。"
  },
  {
    "source": "concept_robot_autonomy",
    "target": "concept_human_agency",
    "relation_type": "conflicts_with",
    "description": "High autonomy may reduce perceived human control.",
    "evidence": [
      "S07"
    ],
    "directionality": "directed",
    "confidence_level": "medium",
    "design_implication": "设计接管和确认。"
  },
  {
    "source": "concept_trust_calibration",
    "target": "metric_trust",
    "relation_type": "derived_from",
    "description": "Trust calibration refines the trust construct toward appropriate reliance.",
    "evidence": [
      "S06"
    ],
    "directionality": "directed",
    "confidence_level": "high",
    "design_implication": "信任过高和过低都是风险。"
  },
  {
    "source": "concept_transparency",
    "target": "concept_trust_calibration",
    "relation_type": "improves",
    "description": "Transparency can help users form calibrated trust.",
    "evidence": [
      "S06"
    ],
    "directionality": "directed",
    "confidence_level": "high",
    "design_implication": "说明系统能力和限制。"
  },
  {
    "source": "concept_explainability",
    "target": "concept_transparency",
    "relation_type": "supports",
    "description": "Explanations support transparency when task-relevant.",
    "evidence": [
      "S06"
    ],
    "directionality": "directed",
    "confidence_level": "medium",
    "design_implication": "解释应围绕用户决策。"
  },
  {
    "source": "concept_explainability",
    "target": "metric_trust",
    "relation_type": "influences",
    "description": "Explanations can influence perceived trust.",
    "evidence": [
      "S06"
    ],
    "directionality": "directed",
    "confidence_level": "medium",
    "design_implication": "需要避免过度解释。"
  },
  {
    "source": "concept_legible_motion",
    "target": "concept_predictability",
    "relation_type": "related_to",
    "description": "Legibility and predictability are related but distinct motion qualities.",
    "evidence": [
      "S13"
    ],
    "directionality": "directed",
    "confidence_level": "high",
    "design_implication": "意图清晰不等同于轨迹常规。"
  },
  {
    "source": "concept_legible_motion",
    "target": "metric_safety",
    "relation_type": "improves",
    "description": "Legible motion can improve perceived safety and coordination.",
    "evidence": [
      "S13"
    ],
    "directionality": "directed",
    "confidence_level": "medium",
    "design_implication": "让目标更易推断。"
  },
  {
    "source": "tech_motion_planning",
    "target": "concept_legible_motion",
    "relation_type": "enables",
    "description": "Motion planning can optimize for legibility.",
    "evidence": [
      "S13"
    ],
    "directionality": "directed",
    "confidence_level": "high",
    "design_implication": "规划目标需包含人类推断。"
  },
  {
    "source": "tech_ar_mr_interface",
    "target": "modality_visual_ar",
    "relation_type": "enables",
    "description": "AR/MR interfaces provide visual augmentation.",
    "evidence": [
      "S12",
      "S30"
    ],
    "directionality": "directed",
    "confidence_level": "high",
    "design_implication": "可视化路径和安全区。"
  },
  {
    "source": "tech_ar_mr_interface",
    "target": "concept_situation_awareness",
    "relation_type": "improves",
    "description": "AR can make robot state and plans visible.",
    "evidence": [
      "S12"
    ],
    "directionality": "directed",
    "confidence_level": "medium",
    "design_implication": "用于远程操作和协作工位。"
  },
  {
    "source": "tech_ar_mr_interface",
    "target": "scenario_industrial_assembly",
    "relation_type": "used_in",
    "description": "AR/MR can support collaborative workstations.",
    "evidence": [
      "S11",
      "S12"
    ],
    "directionality": "directed",
    "confidence_level": "medium",
    "design_implication": "显示安全区和下一步动作。"
  },
  {
    "source": "tech_ar_mr_interface",
    "target": "scenario_public_cleaning",
    "relation_type": "used_in",
    "description": "AR concepts can support public understanding of robot paths.",
    "evidence": [
      "S12"
    ],
    "directionality": "directed",
    "confidence_level": "medium",
    "design_implication": "公共演示可用移动 AR。"
  },
  {
    "source": "modality_visual_ar",
    "target": "metric_situation_awareness",
    "relation_type": "measured_by",
    "description": "AR feedback can be evaluated through situation awareness.",
    "evidence": [
      "S20"
    ],
    "directionality": "directed",
    "confidence_level": "medium",
    "design_implication": "评估用户是否理解未来路径。"
  },
  {
    "source": "tech_llm_agent_layer",
    "target": "opportunity_llm_robot_mediator",
    "relation_type": "enables",
    "description": "LLM layer enables natural-language task mediation.",
    "evidence": [
      "S27",
      "S28",
      "S29"
    ],
    "directionality": "directed",
    "confidence_level": "medium",
    "design_implication": "必须加入可执行性和安全确认。"
  },
  {
    "source": "tech_llm_agent_layer",
    "target": "concept_explainability",
    "relation_type": "challenges",
    "description": "LLM mediation introduces opacity and accountability issues.",
    "evidence": [
      "S27"
    ],
    "directionality": "directed",
    "confidence_level": "medium",
    "design_implication": "需要显示来源、计划和置信度。"
  },
  {
    "source": "tech_llm_agent_layer",
    "target": "concept_affordance",
    "relation_type": "depends_on",
    "description": "LLM robot plans must be grounded in robot affordances.",
    "evidence": [
      "S27"
    ],
    "directionality": "directed",
    "confidence_level": "high",
    "design_implication": "把“能说”限制为“能做”。"
  },
  {
    "source": "discipline_embodied_ai",
    "target": "discipline_robotics",
    "relation_type": "extends",
    "description": "Embodied AI extends robotics with foundation model reasoning.",
    "evidence": [
      "S27",
      "S28",
      "S29"
    ],
    "directionality": "directed",